"Journal Data Filtered By:  Selected JCR Year: 2017 Selected Categories: 'CELL & TISSUE ENGINEERING','CELL BIOLOGY','CLINICAL NEUROLOGY','ENGINEERING, BIOMEDICAL','MULTIDISCIPLINARY SCIENCES','NEUROIMAGING','NEUROSCIENCES'",,,,,,,,,,,,,
Rank,Full Journal Title,Total Cites,Journal Impact Factor,Eigenfactor Score,Title29, Title20,ISSN,EISSN,Category,Years,WikiLink,Link,Description
79,Acta Biomaterialia,"30,640",6.383,0.049,ACTA BIOMATER,ACTA BIOMATER,1742-7061,1878-7568,Materials Science,2005–present,https://en.wikipedia.org/wiki/Acta_Biomaterialia,https://www.journals.elsevier.com/acta-biomaterialia/,"Acta Biomaterialia is a monthly peer-reviewed scientific journal published by Elsevier. It is published on behalf of Acta Materialia, Inc., and is sponsored by ASM International and The Minerals, Metals & Materials Society. The journal was established in January 2005. The editor-in-chief is W.R. Wagner. Acta Biomaterialia is an international journal that publishes peer-reviewed original research reports, review papers and communications in the broadly defined field of biomaterials science. The emphasis of the journal is on the relationship between biomaterial structure and function at all length scales."
16,Acta Neuropathologica,"18,786",15.876,0.041,ACTA NEUROPATHOL,ACTA NEUROPATHOL,0001-6322,1432-0533,Neuroscience & Behavior,1961–present,https://en.wikipedia.org/wiki/Acta_Neuropathologica,https://www.springer.com/medicine/pathology/journal/401,"Acta Neuropathologica is a monthly peer-reviewed scientific journal covering all aspects of neuropathology published by Springer Science+Business Media. It was established in 1961 and the editor-in-chief is Werner Paulus. Acta Neuropathologica aims to publish the best papers on pathology of neurological disease, as well as experimental studies on molecular and cellular mechanisms using in vitro and in vivo models, ideally validated by analysis of human tissues."
99,Advanced Healthcare Materials,"6,465",5.609,0.02,ADV HEALTHC MATER,ADV HEALTHC MATER,2192-2640,2192-2659,Materials Science,2012–present,null,https://onlinelibrary.wiley.com/journal/21922659,"Advanced Healthcare Materials is an international, interdisciplinary forum for peer-reviewed papers on materials science aimed at promoting human health. Advanced Healthcare Materials was first published as a special focus section in Advanced Materials in 2011 and launched as a journal at the start of 2012. Advanced Healthcare Materials bridges the gap between fundamental laboratory research and clinical practice, covering all aspects of materials science in medicine and biotechnology."
51,Ageing Research Reviews,"5,297",8.973,0.012,AGEING RES REV,AGEING RES REV,1568-1637,1872-9649,Clinical Medicine,2002–present,https://en.wikipedia.org/wiki/Ageing_Research_Reviews,https://www.journals.elsevier.com/ageing-research-reviews/,"Ageing Research Reviews is a scientific journal covering ageing published by Elsevier. The editors in chief are Mark Mattson and Robert Brosh, Jr. Ageing Research Reviews publishes research on human life expectancy, ageing and age-related disease. As the average human life expectancy has increased, so too has the impact of ageing and age-related disease on our society. Ageing research is now the focus of thousands of laboratories that include leaders in the areas of genetics, molecular and cellular biology, biochemistry, and behaviour. Ageing Research Reviews (ARR) covers the trends in this field. It is designed to fill a large void, namely, a source for critical reviews and viewpoints on emerging findings on mechanisms of ageing and age-related disease."
64,Aging Cell,"8,067",7.627,0.019,AGING CELL,AGING CELL,1474-9726,1474-9726,Molecular Biology & Genetics,2002–present,https://en.wikipedia.org/wiki/Aging_Cell,https://onlinelibrary.wiley.com/journal/14749726,"Aging Cell is a peer-reviewed scientific journal and an official journal of the Anatomical Society. It is published on their behalf by John Wiley & Sons. It was established in 2002 and the editors-in-chief are Peter Adams, Adam Antebi, Ana Maria Cuervo, Brian Kennedy, and John Sedivy. The aim of Aging Cell is to publish the highest quality, innovative research addressing fundamental issues in the biology of aging. For publication in Aging Cell, the work must provide a major new contribution to the understanding of aging and be of general interest to the community. Aging Cell seeks to cover all areas of geroscience, highlighting research that uncovers mechanistic aspects of the aging process, as well as the links between aging and age-related disease. Observations of novel aging processes without substantial mechanistic insight will be considered, but should be of especially high impact for the field."
25,Alzheimers & Dementia,"10,436",12.764,0.03,ALZHEIMERS DEMENT,ALZHEIMERS DEMENT,1552-5260,1552-5279,Neuroscience & Behavior,2005–present,null,https://www.alzheimersanddementia.com/,"The mission of Alzheimer's & Dementia: Journal of the Alzheimer's Association is to bridge the knowledge gaps across a wide range of bench-to-bedside investigation. The journal publishes the results of studies in: behavior, biochemistry, genetics, molecular biology, pharmacology, physiology, protein chemistry, neurology, neuropathology, psychiatry, geriatrics, neuropsychology, epidemiology, sociology, health services research, health economics, political science and public policy. Content emphasizes interdisciplinary investigations, integrative/translational articles, related to: etiology, risk factors, early detection, disease modifying interventions, prevention of dementia and applications of new technologies in health services."
39,Annals of Neurology,"37,259",10.25,0.053,ANN NEUROL,ANN NEUROL,0364-5134,1531-8249,Neuroscience & Behavior,1977–present,https://en.wikipedia.org/wiki/Annals_of_Neurology,https://onlinelibrary.wiley.com/journal/15318249,"Annals of Neurology is a peer-reviewed medical journal covering neurology. It is published by John Wiley & Sons and is edited by Clifford B. Saper. Annals of Neurology publishes articles of broad interest with potential for high impact in understanding the mechanisms and treatment of diseases of the human nervous system. All areas of clinical and basic neuroscience, including new technologies, cellular and molecular neurobiology, population sciences, and studies of behavior, addiction, and psychiatric diseases are of interest to the journal."
53,Annual Review of Biomedical Engineering,"4,653",8.788,0.006,ANNU REV BIOMED ENG,ANNU REV BIOMED ENG,1523-9829,null,Molecular Biology & Genetics,1999–present,https://en.wikipedia.org/wiki/Annual_Review_of_Biomedical_Engineering,https://www.annualreviews.org/journal/bioeng,"Annual Review of Biomedical Engineering is an academic journal published by Annual Reviews. In publication since 1999, this journal covers the significant developments in the broad field of biomedical engineering. Topics include biomechanics, biomaterials, computational genomics and proteomics, tissue engineering, biomonitoring, health care engineering, drug delivery bioelectrical engineering, biochemical engineering, and biomedical imaging topics. It is edited by Martin L. Yarmush."
49,Annual Review of Cell and Developmental Biology,"9,812",9.032,0.017,ANNU REV CELL DEV BIOL,ANNU REV CELL DEV BI,1081-0706,null,Molecular Biology & Genetics,1985–present,https://en.wikipedia.org/wiki/Annual_Review_of_Cell_and_Developmental_Biology,https://www.annualreviews.org/journal/cellbio,"The Annual Review of Cell and Developmental Biology is an annual peer-reviewed scientific journal covering developmental and cell biology. It is published by Annual Reviews and the editor-in-chief is Randy Schekman. It was established in 1985 as the Annual Review of Cell Biology and obtained its current title in 1995. The Annual Review of Cell and Developmental Biology, in publication since 1985, covers the most significant developments in the field of cell and developmental biology, including structure, function, and organization of the cell, development and evolution of the cell as it relates to single and multicellular organisms, and models and tools of molecular biology."
20,Annual Review of Neuroscience,"13,320",14.675,0.016,ANNU REV NEUROSCI,ANNU REV NEUROSCI,0147-006X,null,Neuroscience & Behavior,1978–present,null,https://www.annualreviews.org/journal/neuro,"The Annual Review of Neuroscience, in publication since 1978, covers the significant developments across the entire field of neuroscience, including molecular and cellular neuroscience, neurogenetics, development, plasticity and repair, systems neuroscience, cognitive neuroscience, behavior, and neurobiology of disease, with occasional reviews in history of neuroscience and ethics."
34,Autophagy,"14,923",11.1,0.036,AUTOPHAGY,AUTOPHAGY,1554-8627,1554-8635,Molecular Biology & Genetics,2005–present,https://en.wikipedia.org/wiki/Autophagy_(journal),https://www.tandfonline.com/action/journalInformation?show=aimsScope&journalCode=kaup20&,"Autophagy is a monthly peer-reviewed scientific journal covering all aspects of cell autophagy. It is published by Taylor & Francis and the editor-in-chief is Daniel J. Klionsky. Autophagy is a highly selective peer-reviewed journal that publishes papers on all aspects of autophagic processes. The field of autophagy has advanced tremendously, due in large part to the multiple connections between autophagy and various aspects of human health and disease including cancer, neurodegeneration, aging, diabetes, myopathies and heart disease. Our goal is to be the premiere journal in this field, publishing papers that you want read by the people in your research group."
19,Behavioral and Brain Sciences,"8,900",15.071,0.01,BEHAV BRAIN SCI,BEHAV BRAIN SCI,0140-525X,1469-1825,Neuroscience & Behavior,1978–present,https://en.wikipedia.org/wiki/Behavioral_and_Brain_Sciences,https://www.cambridge.org/core/journals/behavioral-and-brain-sciences,"Behavioral and Brain Sciences is a peer-reviewed scientific journal of Open Peer Commentary established in 1978 by Stevan Harnad and published by Cambridge University Press. It is modeled on the journal Current Anthropology. BBS is the internationally renowned journal with the innovative format known as Open Peer Commentary. Particularly significant and controversial pieces of work are published from researchers in any area of psychology, neuroscience, behavioral biology or cognitive science, together with 20-40 commentaries on each article from specialists within and across these disciplines, plus the author's response to them. The result is a fascinating and unique forum for the communication, criticism, stimulation, and particularly the unification of research in behavioral and brain sciences from molecular neurobiology to artificial intelligence and the philosophy of the mind."
72,Biofabrication,"2,758",6.838,0.006,BIOFABRICATION,BIOFABRICATION,1758-5082,1758-5090,Materials Science,2009–present,https://en.wikipedia.org/wiki/Biofabrication,http://iopscience.iop.org/journal/1758-5090,"Biofabrication is a peer-reviewed scientific journal covering research that leads to the fabrication of advanced biological models, medical therapeutic products, and non-medical biological systems. The editor-in-chief is Wei Sun. Biofabrication™ focuses on cutting-edge research regarding the use of cells, proteins, biological materials and biomaterials as building blocks to manufacture biological systems and/or therapeutic products."
28,Biological Psychiatry,"42,495",11.984,0.057,BIOL PSYCHIAT,BIOL PSYCHIAT,0006-3223,1873-2402,Neuroscience & Behavior,1959–present,https://en.wikipedia.org/wiki/Biological_Psychiatry_(journal),https://www.biologicalpsychiatryjournal.com/,"Biological Psychiatry is a biweekly, peer-reviewed, scientific journal of psychiatric neuroscience and therapeutics, published by Elsevier since 1985 on behalf of the Society of Biological Psychiatry, of which it is the official journal. Biological Psychiatry is the official journal of the Society of Biological Psychiatry, whose purpose is to promote excellence in scientific research and education in fields that investigate the nature, causes, mechanisms and treatments of disorders of thought, emotion, or behavior. In accord with this mission, this peer-reviewed, rapid-publication, international journal publishes both basic and clinical contributions from all disciplines and research areas relevant to the pathophysiology and treatment of major psychiatric disorders."
52,Biomaterials,"108,908",8.806,0.115,BIOMATERIALS,BIOMATERIALS,0142-9612,1878-5905,Materials Science,1980–present,https://en.wikipedia.org/wiki/Biomaterials_(journal),https://www.journals.elsevier.com/biomaterials,"Biomaterials is a quarterly peer reviewed scientific journal covering the physical, biological and chemical sciences involved in engineering biomaterials. It is published by Elsevier. The co-editor in chiefs are K.W. Leong and D.F. Williams. Biomaterials is an international journal covering the science and clinical application of biomaterials. It is the aim of the journal to provide a peer-reviewed forum for the publication of original papers and authoritative review and opinion papers dealing with the most important issues facing the use of biomaterials in clinical practice. The scope of the journal covers the wide range of physical, biological and chemical sciences that underpin the design of biomaterials and the clinical disciplines in which they are used."
26,Bone Research,977,12.354,0.002,BONE RES,BONE RES,2095-4700,2095-6231,Biology & Biochemistry,2012–present,https://en.wikipedia.org/wiki/Bone_%26_Joint_Research,https://www.nature.com/boneres/,"Bone Research was founded in 2013. As a new English-language periodical, Bone Research focuses on basic and clinical aspects of bone biology, pathophysiology and regeneration, and supports the foremost discoveries resulting from basic investigations and clinical research related to bone. The aim of the Journal is to foster the worldwide dissemination of research in bone-related physiology, pathology, diseases and treatment."
36,Brain,"52,067",10.848,0.075,BRAIN,BRAIN,0006-8950,1460-2156,Neuroscience & Behavior,1878–present,https://en.wikipedia.org/wiki/Brain_(journal),https://academic.oup.com/brain,"Brain: A Journal of Neurology is a peer-reviewed scientific journal of neurology, founded in 1878 by John Charles Bucknill, David Ferrier, James Crichton-Browne and John Hughlings Jackson. It is currently published by Oxford University Press. "
82,Brain Behavior and Immunity,"12,583",6.306,0.027,BRAIN BEHAV IMMUN,BRAIN BEHAV IMMUN,0889-1591,1090-2139,Neuroscience & Behavior,1987–present,"https://en.wikipedia.org/wiki/Brain,_Behavior,_and_Immunity",https://www.journals.elsevier.com/brain-behavior-and-immunity/,"Brain, Behavior, and Immunity is a peer-reviewed scientific journal published by Elsevier. It was established in 1987 by Robert Ader, and covers research on the relationship between the nervous system, psychology, and the immune system. It is the official journal of the Psychoneuroimmunology Research Society. This innovative journal publishes peer-reviewed basic, experimental, and clinical studies dealing with behavioral, neural, endocrine, and immune system interactions in humans and animals. It is an international, interdisciplinary journal devoted to original research in neuroscience, immunology, integrative physiology, behavioral biology, psychiatry, psychology, and clinical medicine and is inclusive of research at the molecular, cellular, social, and whole organism level."
85,Brain Pathology,"4,952",6.187,0.008,BRAIN PATHOL,BRAIN PATHOL,1015-6305,1750-3639,Neuroscience & Behavior,1990–present,https://en.wikipedia.org/wiki/Brain_Pathology,https://onlinelibrary.wiley.com/journal/17503639,"Brain Pathology is the medical journal of the International Society of Neuropathology, published for them by John Wiley & Sons. Brain Pathology is a peer-reviewed bi-monthly publication that includes original research, review articles and symposia focusing on the pathogenesis of neurological disease.  Brain Pathology is the journal of choice for biomedical scientists investigating diseases of the nervous system."
88,Brain Stimulation,"4,263",6.12,0.015,BRAIN STIMUL,BRAIN STIMUL,1935-861X,1876-4754,Neuroscience & Behavior,2008–present,https://en.wikipedia.org/wiki/Brain_Stimulation_(journal),https://www.journals.elsevier.com/brain-stimulation/,"Brain Stimulation is a bimonthly peer-reviewed medical journal covering the field of neuromodulation. It was established in 2008 and is published by Elsevier. The editor-in-chief is Mark S. George. The scope of Brain Stimulation extends across the entire field of brain stimulation, including noninvasive and invasive techniques and technologies that alter brain function through the use of electrical, magnetic, radiowave, or focally targeted pharmacologic stimulation. This includes investigations that study the effects of brain stimulation on basic processes, such as gene expression and other aspects of molecular biology, neurochemical regulation, functional brain activity, sensorimotor function, and cognitive and affective processes at the systems level."
9,Cancer Cell,"35,217",22.844,0.097,CANCER CELL,CANCER CELL,1535-6108,1878-3686,Molecular Biology & Genetics,2002-present,https://en.wikipedia.org/wiki/Cancer_Cell_(journal),https://www.cell.com/cancer-cell/home,Cancer Cell is a peer-reviewed scientific journal published by Cell Press. It covers all aspects of cancer research at the cellular-level. The journal was established in February 2002 and the editor-in-chief is Li-Kuo Su. Cancer Cell provides a high-profile forum to promote major advances in cancer research and oncology. The primary criterion for considering manuscripts is whether the studies provide major advances into answering important questions relevant to naturally occurring cancers. Cancer Cell particularly welcomes translational research.
6,Cell,"230,625",31.398,0.583,CELL,CELL,0092-8674,1097-4172,Molecular Biology & Genetics,1974-present,https://en.wikipedia.org/wiki/Cell_(journal),https://www.cell.com/cell/home,"Cell is a peer-reviewed scientific journal publishing research papers across a broad range of disciplines within the life sciences. Areas covered include molecular biology, cell biology, systems biology, stem cells, developmental biology, genetics and genomics, proteomics, cancer research, immunology, neuroscience, structural biology, microbiology, virology, physiology, biophysics, and computational biology. The journal was established in 1974 by Benjamin Lewin and is published twice monthly by Cell Press, an imprint of Elsevier. The basic criterion for considering papers is whether the results provide significant conceptual advances into, or raise provocative questions and hypotheses regarding, an interesting and important biological question."
98,Cell Death & Disease,"14,475",5.638,0.046,CELL DEATH DIS,CELL DEATH DIS,2041-4889,2041-4889,Molecular Biology & Genetics,2010-present,null,https://www.nature.com/cddis/,"Brought to you by the editorial team of Cell Death & Differentiation, Cell Death & Disease is a peer-reviewed online journal in the field of translational cell death. It seeks to promote diverse and integrated areas of experimental and internal medicine with its specialties, including cancer, immunity and neuroscience. It is now also accepting articles in a new area: cancer metabolism. Cell Death & Disease seeks to encompass the breadth of translational implications of cell death."
63,Cell Death and Differentiation,"18,865",8,0.032,CELL DEATH DIFFERENTIATION,CELL DEATH DIFFER,1350-9047,1476-5403,Molecular Biology & Genetics,2002-present,https://en.wikipedia.org/wiki/Cell_Death_%26_Differentiation,https://www.nature.com/cdd/,"Cell Death & Differentiation is a peer reviewed academic journal published by Nature Publishing Group. It devotes itself to scientific excellence in the field of cell biology, molecular biology, and biochemistry of cell death and disease. It also, provides a unified forum for scientists and clinical researchers. It is committed to the rapid publication of high quality original papers relating to these subjects, together with topical, usually solicited, reviews, meeting reports, editorial correspondence and occasional commentaries on controversial and scientifically informative issues."
10,Cell Metabolism,"29,834",20.565,0.102,CELL METAB,CELL METAB,1550-4131,1932-7420,Molecular Biology & Genetics,2005-present,https://en.wikipedia.org/wiki/Cell_Metabolism,https://www.cell.com/cell-metabolism/home,"Cell Metabolism, launched in January 2005, is one of the newer titles in the Cell Press family. The journal focuses on physiology, with an emphasis on understanding the molecular basis of how the body self-regulates in the face of change, and how disturbances in these balances can lead to disease. Created in response to what top scientists saw as a growing need for a specialized journal in this field, Cell Metabolism is run by in-house editorial and production teams with full responsibility for selecting and preparing content for publication."
62,Cell Reports,"29,789",8.032,0.211,CELL REPORTS,CELL REP,2211-1247,2211-1247,Molecular Biology & Genetics,2012-present,https://en.wikipedia.org/wiki/Cell_Reports,https://www.cell.com/cell-reports/home,"Cell Reports is a peer-reviewed scientific journal publishing research papers across a broad range of disciplines within the life sciences. The journal was established in 2012 and is the first open access journal published by Cell Press, an imprint of Elsevier. The primary criterion for publication in Cell Reports, as for all Cell Press journals, is new biological insight. Cell Reports publishes thought-provoking, cutting-edge research, with a focus on a shorter, single-point story, called a Report, in addition to a longer Article format."
18,Cell Research,"13,728",15.393,0.037,CELL RES,CELL RES,1001-0602,1748-7838,Molecular Biology & Genetics,1990-present,https://en.wikipedia.org/wiki/Cell_Research,https://www.nature.com/cr/,"Cell Research is a monthly peer-reviewed scientific journal covering cell biology. It is published by the Nature Publishing Group on behalf of the Shanghai Institutes for Biological Sciences and is affiliated with the Chinese Society for Cell Biology. It was established in 1990. The editor-in-chief is Gang Pei. Cell Research (CR) publishes original research results that are of unusual significance or broad conceptual or technical advances in all areas of life sciences, as long as the study is closely related to molecular and cell biology. The journal has an international authorship and a broad scope in basic research."
8,Cell Stem Cell,"23,493",23.29,0.096,CELL STEM CELL,CELL STEM CELL,1934-5909,1875-9777,Molecular Biology & Genetics,2007-present,https://en.wikipedia.org/wiki/Cell_Stem_Cell,https://www.cell.com/cell-stem-cell/home,"Cell Stem Cell is a peer-reviewed scientific journal published by Cell Press, an imprint of Elsevier. The journal was established in 2007 and focuses on stem cell research. Both research articles and reviews are published, at about a 7 to 1 ratio. Cell Stem Cell is a broad-spectrum journal that covers the entire spectrum of stem cell biology. Topics covered include embryonic stem cells, pluripotency, germline stem cells, tissue-specific stem cells, stem cell differentiation, epigenetics, stem cell genomics and systems biology, genome reprogramming, cancer stem cells, stem cell niches, stem-cell-based disease models, nuclear transfer technology, bioengineering, drug discovery, in vivo imaging of stem cells, therapeutic applications, regenerative medicine, clinical and translational insights, stem cell research policies, ethical issues, and technical or resource-based innovations."
50,Cell Systems,"1,129",8.982,0.01,CELL SYST,CELL SYST,2405-4712,2405-4720,Biology & Biochemistry,2015-present,null,https://www.cell.com/cell-systems/home,"Cell Systems is a broad, multidisciplinary monthly journal for outstanding research that provides, supports, or applies systems-level understanding in the life sciences and related disciplines. Quantitative integrative studies that reveal general principles of systems are particularly welcome. The journal’s scope includes systems at all scales-from molecules, pathways, cells, and tissues to whole organisms, populations, and ecosystems-and a diversity of traditional disciplines."
73,Cellular and Molecular Life Sciences,"23,341",6.721,0.041,CELL MOL LIFE SCI,CELL MOL LIFE SCI,1420-682X,1420-9071,Molecular Biology & Genetics,1945-present,https://en.wikipedia.org/wiki/Cellular_and_Molecular_Life_Sciences,https://www.springer.com/life+sciences/cell+biology/journal/18,"Cellular and Molecular Life Sciences is a peer-reviewed scientific journal covering cellular and molecular life sciences. It was established in 1945 as Experientia, obtaining its current name in 1994. The journal is published by and the editor-in-chief is Klaus Eichmann. Based in Basel, Switzerland, the multidisciplinary journal Cellular and Molecular Life Sciences (CMLS) publishes research articles, reviews, multi-author reviews and visions & reflections articles covering the latest aspects of biological and biomedical research. The journal will consider contributions focusing on biochemistry and molecular biology, cell biology, molecular and cellular aspects of biomedicine, neuroscience, pharmacology and immunology."
